{
  "$schema": "./schemas/brand.schema.json",
  "schemaVersion": 1,
  "lastVerified": "2026-10-16",
  "canonicalHome": "https://elixpo.com/assets",
  "sourceRepository": "https://github.com/elixpo/branding",
  "migrationStatus": "portal-canonical-assets-migrated",
  "visualDirection": {
    "name": "Open Field",
    "approvalStatus": "approved",
    "principle": "Warm institutional clarity with the Oreo mascot used as a human signal, not as decoration on every surface.",
    "palette": [
      { "name": "Paper", "hex": "#F6F5F0" },
      { "name": "Ink", "hex": "#142018" },
      { "name": "Foundry green", "hex": "#0B623C" },
      { "name": "Field green", "hex": "#18A466" },
      { "name": "Archive warm", "hex": "#F0E6D3" }
    ],
    "typography": {
      "sans": "Use the system sans stack for navigation, body text, data and primary headlines.",
      "serif": "Use the display serif for short editorial clauses and emphasis, never for dense interface copy.",
      "mono": "Use the monospace stack for labels, dates, versions, provenance and compact technical metadata."
    },
    "geometry": [
      "Build layouts from generous editorial grids, large rounded fields and fine structural rules.",
      "Use circles, arcs and asymmetric fields to show relationships or movement, not as empty decoration.",
      "Use a restrained dot texture only where it does not compete with text or evidence."
    ],
    "iconography": "Use a project's verified icon when one exists and an original geometric fallback when it does not. Do not borrow another organization's signature symbols.",
    "mascotUsage": {
      "useFor": ["Primary organization identity", "Community invitations", "Events", "Sticker artwork", "Friendly onboarding moments"],
      "avoidFor": ["Default research-paper decoration", "Dense technical documentation", "Infrastructure status surfaces", "Every package or project card"],
      "rule": "Oreo is a recognizable human signal. Keep the approved proportions and marks, and do not let the mascot replace evidence, diagrams or project identity."
    },
    "motion": [
      "Prefer short opacity and transform transitions that explain hierarchy or state.",
      "Keep touch scrolling native; enhanced inertia is optional on capable pointer devices.",
      "Disable non-essential animation when reduced motion is requested."
    ],
    "accessibility": [
      "Maintain WCAG AA contrast for text and controls.",
      "Do not communicate status through colour alone.",
      "Keep focus states visible and all actions keyboard reachable.",
      "Provide meaningful alternative text for informative artwork and empty alternative text for decoration."
    ]
  },
  "assetGroups": [
    { "name": "Primary marks", "path": "/brand/source/marks", "status": "canonical" },
    { "name": "Project icons", "path": "/brand/source/icons", "status": "canonical" },
    { "name": "Social templates", "path": "/brand/source/social", "status": "canonical" },
    { "name": "Sticker samples", "path": "/brand/stickers", "status": "canonical" }
  ],
  "audit": {
    "auditedAt": "2026-10-16",
    "sourceRevision": "7c274b1ca900eb8f21f4ded811779963ba8f0c21",
    "sourceTreeClean": true,
    "standaloneTrackedFiles": 618,
    "standaloneDiskSizeBytes": 779259920,
    "portalBrandFiles": 43,
    "portalBrandDiskSizeBytes": 16067466,
    "exactMasterDuplicates": 21,
    "sourceBreakdown": [
      { "group": "Sticker artwork and sheets", "trackedFiles": 168 },
      { "group": "Generation prompts", "trackedFiles": 299 },
      { "group": "Generated Open Graph images", "trackedFiles": 27 },
      { "group": "Generation pipeline", "trackedFiles": 14 },
      { "group": "Mascot videos", "trackedFiles": 9 },
      { "group": "Project icon masters", "trackedFiles": 15 },
      { "group": "LixBlogs badge artwork", "trackedFiles": 25 }
    ],
    "exactDuplicateGroups": [
      "15 project icon masters",
      "3 primary mark masters",
      "3 LinkedIn social masters"
    ],
    "excludedFromPublicMigration": [
      ".env and all encrypted or unencrypted credentials",
      ".sops.yaml and environment-specific secret-management configuration",
      "local caches, virtual environments, and generated temporary files"
    ],
    "migrationPrinciples": [
      "Preserve source history before archiving the standalone repository.",
      "Keep editable masters, optimized web derivatives, prompts, and generated outputs in separate directories.",
      "Do not copy exact duplicates or secrets into the portal.",
      "Record provenance and artifact-specific licensing for every migrated group."
    ]
  },
  "note": "The portal now owns the public canonical copies. Generation pipelines, prompts, sticker archives, and their provenance remain staged for a separate reviewed migration before the standalone branding repository can be archived."
}
